{
  "accounting_reconciliation": {
    "aggregate": {
      "browser_actions": 2,
      "cached_input_tokens": 0,
      "input_tokens": 10073,
      "model_calls": 9,
      "output_tokens": 1515,
      "recomputed_cost_usd": "0.0403325",
      "total_tokens": 11588,
      "unreconciled_provider_attempts": 0,
      "wall_seconds_display_3dp": "39.397",
      "wall_seconds_raw": "39.397491319999743"
    },
    "formula": "((input_tokens-cached_input_tokens)*2.50 + cached_input_tokens*1.25 + output_tokens*10.00) / 1,000,000",
    "per_call_usage": {
      "evidence_refs": [],
      "note": "No raw per-call provider usage receipt was retained.",
      "provenance": "unavailable",
      "value": null
    },
    "price_record": {
      "binding_provenance": "derived",
      "rates_per_million_tokens": {
        "cached_input": "1.25",
        "input": "2.5",
        "output": "10"
      },
      "record_id": "PRICE-OPENAI-GPT4O-2026-08-08",
      "record_sha256_at_frozen_commit": "60df592cecf4c64eac8be0ec07d6599d3dcd0d06bab02835a3ab726beb89b437",
      "run_bundle_binds_price_record_hash": false,
      "runtime_rates_match_record": true
    },
    "reactive": {
      "browser_actions": 1,
      "cached_input_tokens": 0,
      "input_tokens": 4626,
      "model_calls": 4,
      "output_tokens": 260,
      "recomputed_cost_usd": "0.014165",
      "reported_cost_usd_raw": "0.014164999999999995",
      "total_tokens": 4886,
      "unreconciled_provider_attempts": 0,
      "wall_seconds_raw": "18.019464842999923"
    },
    "retry_reconciliation": {
      "condition_retries": {
        "evidence_refs": [
          "remote_archive:run-manifest.json"
        ],
        "provenance": "observed",
        "value": 0
      },
      "parser_retry_count": {
        "evidence_refs": [
          "remote_archive:evidence/reactive/provider-budget.json",
          "remote_archive:evidence/simulative/provider-budget.json"
        ],
        "note": "Observed call counts match the successful one-step paths and retained logs contain no parser failure, but calls were not tagged with retry_kind.",
        "provenance": "inferred",
        "value": 0
      },
      "transport_retries": {
        "evidence_refs": [
          "repository:src/giclab/harness/sira_gate_a_runtime.py@frozen-commit"
        ],
        "provenance": "derived",
        "value": 0
      }
    },
    "rounding": "Exact decimal arithmetic is authoritative; display values use decimal strings. Raw JSON binary-float spellings are retained separately.",
    "simulative": {
      "browser_actions": 1,
      "cached_input_tokens": 0,
      "input_tokens": 5447,
      "model_calls": 5,
      "output_tokens": 1255,
      "recomputed_cost_usd": "0.0261675",
      "reported_cost_usd_raw": "0.026167500000000034",
      "total_tokens": 6702,
      "unreconciled_provider_attempts": 0,
      "wall_seconds_raw": "21.37802647699982"
    }
  },
  "adjudication_id": "T08-SIRA-SMOKE-EVIDENCE-ADJUDICATION-0001",
  "artifact_execution": {
    "reactive": "passed",
    "simulative": "passed"
  },
  "cleanup": {
    "api_key_secret_scans_passed": true,
    "classification": "cleanup_verified_with_nonmaterial_gap",
    "credential_rotation_required": false,
    "ephemeral_provider_access_material": {
      "affected_artifact_count": 37,
      "affected_artifacts": [
        "local_retained:instance-poll-007.json",
        "local_retained:instance-poll-008.json",
        "local_retained:instance-poll-009.json",
        "local_retained:instance-poll-010.json",
        "local_retained:instance-poll-011.json",
        "local_retained:instance-poll-012.json",
        "local_retained:instance-poll-013.json",
        "local_retained:instance-poll-014.json",
        "local_retained:instance-poll-015.json",
        "local_retained:instance-poll-016.json",
        "local_retained:instance-poll-017.json",
        "local_retained:instance-poll-018.json",
        "local_retained:instance-poll-019.json",
        "local_retained:instance-poll-020.json",
        "local_retained:instance-poll-021.json",
        "local_retained:instance-poll-022.json",
        "local_retained:instance-poll-023.json",
        "local_retained:instance-poll-024.json",
        "local_retained:termination-poll-001.json",
        "local_retained:termination-poll-002.json",
        "local_retained:termination-poll-003.json",
        "local_retained:termination-poll-004.json",
        "local_retained:termination-poll-005.json",
        "local_retained:termination-poll-006.json",
        "local_retained:termination-poll-007.json",
        "local_retained:termination-poll-008.json",
        "local_retained:termination-poll-009.json",
        "local_retained:termination-poll-010.json",
        "local_retained:termination-poll-011.json",
        "local_retained:termination-poll-012.json",
        "local_retained:termination-poll-013.json",
        "local_retained:termination-poll-014.json",
        "local_retained:termination-poll-015.json",
        "local_retained:termination-poll-016.json",
        "local_retained:termination-poll-017.json",
        "local_retained:termination-poll-018.json",
        "local_retained:termination-response.json"
      ],
      "classification": "private-retention-gap",
      "current_validity": "invalidated-by-provider-instance-termination",
      "secret_values_emitted": false,
      "sensitive_key_names": [
        "jupyter_token",
        "jupyter_url"
      ]
    },
    "exact_instance_identity": {
      "evidence_refs": [
        "local_retained:run-disposition.json"
      ],
      "provenance": "observed",
      "value": "5e85550b64f4445ebd88a9d2d4172c17"
    },
    "external_archive": {
      "file_count": 148,
      "manifest_sha256": "9fb9ee63c1703e9701e8d5168284a1f757181baadd68a1508095eeac5fc7a167",
      "mismatches": 0,
      "source_destination_hashes_match": true,
      "total_bytes": 22893061
    },
    "global_firewall_sha256": "983d231beefd2e446c4b9261be5da812862a7e629535cb063c6413cd67f55adf",
    "global_firewall_unchanged": true,
    "launch_timestamp": {
      "evidence_refs": [
        "local_retained:run-disposition.json"
      ],
      "provenance": "observed",
      "value": "2026-08-12T21:26:13.097888Z"
    },
    "nonmaterial_gaps": [
      "exact provider termination transition timestamp unavailable",
      "private raw provider responses retain an ephemeral Jupyter access token/URL outside the historical API-key value scan; the terminated instance makes it inactive, and no value is emitted by T08"
    ],
    "owned_containers": 0,
    "owned_regional_rulesets": 0,
    "provider_terminal_absent": true,
    "running_account_instances": 0,
    "temporary_model_secret_removed": true,
    "terminal_absence_verified_at": {
      "evidence_refs": [
        "local_retained:run-disposition.json"
      ],
      "provenance": "observed",
      "value": "2026-08-12T21:52:35.003136Z"
    },
    "termination_timestamp": {
      "evidence_refs": [],
      "note": "The exact provider transition timestamp is absent; terminal absence was later observed.",
      "provenance": "unavailable",
      "value": null
    }
  },
  "conditions": {
    "reactive": {
      "accounting": {
        "browser_actions": 1,
        "cached_input_tokens": 0,
        "input_tokens": 4626,
        "model_calls": 4,
        "output_tokens": 260,
        "recomputed_cost_usd": "0.014165",
        "reported_cost_usd_raw": "0.014164999999999995",
        "total_tokens": 4886,
        "unreconciled_provider_attempts": 0,
        "wall_seconds_raw": "18.019464842999923"
      },
      "artifact_execution": "passed",
      "artifact_execution_basis": {
        "browser_action_performed": {
          "evidence_refs": [
            "remote_archive:evidence/reactive/sira-output/EXP-0001-SMOKE-REACTIVE_2026-08-12-21-47-52.json",
            "remote_archive:evidence/reactive/condition-status.json"
          ],
          "note": "One requested action is retained and the process exited normally, but no structured post-action result proves env.step completion.",
          "provenance": "inferred",
          "value": true
        },
        "model_requests_issued": {
          "evidence_refs": [
            "remote_archive:evidence/reactive/provider-budget.json"
          ],
          "provenance": "observed",
          "value": true
        },
        "normal_exit": {
          "evidence_refs": [
            "remote_archive:evidence/reactive/condition-status.json",
            "remote_archive:evidence/reactive/container-inspect.json"
          ],
          "provenance": "observed",
          "value": true
        },
        "owned_state_cleanup": {
          "evidence_refs": [
            "remote_archive:evidence/reactive/runtime-cleanup.json",
            "remote_archive:evidence/reactive/condition-status.json"
          ],
          "provenance": "observed",
          "value": true
        },
        "runtime_initialized": {
          "evidence_refs": [
            "remote_archive:evidence/reactive/runtime-environment.json",
            "remote_archive:evidence/reactive/condition-started.json"
          ],
          "provenance": "observed",
          "value": true
        },
        "session_evidence_written": {
          "evidence_refs": [
            "remote_archive:evidence/reactive/sira-output/EXP-0001-SMOKE-REACTIVE_2026-08-12-21-47-52.json"
          ],
          "provenance": "observed",
          "value": true
        }
      },
      "reconstruction": {
        "browser_actions": {
          "evidence_refs": [
            "remote_archive:evidence/reactive/sira-output/EXP-0001-SMOKE-REACTIVE_2026-08-12-21-47-52.json",
            "remote_archive:evidence/reactive/provider-budget.json",
            "remote_archive:evidence/reactive/condition-status.json"
          ],